Tipe Kost;Kamar Tersedia;Nama Kost;Lokasi;Fasilitas;Harga Asli;Diskon;Harga /bulan
Putri;;Kost Bedul Merisi Tipe A Wonocolo Surabaya;Wonocolo;K. Mandi Dalam ·WiFi ·Kasur ;;;750000
Putri;;Kost Cozy  Gubeng Surabaya;Kecamatan Gubeng;K. Mandi Dalam ·WiFi ·AC ·Kloset Duduk ·Kasur ;;;1650000
Putri;;Kost House of Sasha Sukolilo Surabaya;Sukolilo;K. Mandi Dalam ·WiFi ·AC ·Kloset Duduk ·Kasur ;;;900000
Putri;;Kost Sidosermo Indah II 15 Wonocolo Surabaya;Kecamatan Wonocolo;K. Mandi Dalam ·WiFi ·AC ·Kloset Duduk ·Kasur ·Akses 24 Jam ;;;1300000
Putra;;Kost Dinda Gubeng Surabaya;Gubeng;WiFi ·AC ·Kloset Duduk ·Kasur ·Akses 24 Jam ;;;1750000
Putra;;Kost Amanah Ngagel Wasana Tipe B Gubeng Surabaya;Gubeng;Kloset Duduk ·Kasur ·Akses 24 Jam ;;;650000
Putra;;Kost Mutiara 1 Tipe A Gubeng Surabaya;Kecamatan Gubeng;K. Mandi Dalam ·Kasur ·Akses 24 Jam ;;;360000
Putri;;Kost Putri Bendul Merisi Selatan III  Tipe D Wonocolo Surabaya;Wonocolo;K. Mandi Dalam ·Kasur ;;;850000
Putra;;Kost Dini Ernawati Tipe AC Gubeng Surabaya;Kecamatan Gubeng;Tidak bisa DP (sewa harian) ·WiFi ·Kloset Duduk ·Kasur ·Akses 24 Jam ;;;1300000
Putri;;Kost Zahrifah Tipe A Wonokromo Surabaya;Kecamatan Wonokromo;Harga termasuk listrik (sewa harian) ·WiFi ·Kasur ·Akses 24 Jam ;;;700000
Campur;;Kost Berkat 2 Single Wonocolo Surabaya;Wonocolo;Check-in pukul 14:00-21:00 (sewa harian) ·Check-out maks. pukul 12:00 (sewa harian) ·Harga termasuk listrik (sewa harian) ·Maksimal 2 orang (sewa harian) ·Pasutri wajib membawa surat nikah (sewa harian) ·Wajib lampirkan KTP saat check-in (sewa harian) ·K. Mandi Dalam ·WiFi ·AC ·Kloset Duduk ·Kasur ;;;1600000
Putri;;Kost Oemahq Sukolilo Surabaya;Sukolilo;K. Mandi Dalam ·WiFi ·Kasur ·Akses 24 Jam ;;;850000
Putri;;Kost Muslimah Gapura Sukolilo Surabaya;Kecamatan Sukolilo;Harga termasuk listrik (sewa harian) ·Kasur ;;;600000
Putra;;Kost Mi Casa Tipe B Wonokromo Surabaya;Kecamatan Wonokromo;WiFi ·Kasur ·Akses 24 Jam ;;;700000
